<?xml version='1.0' encoding='utf-8'?>
<!DOCTYPE certificate
    PUBLIC "-//Moravia Microsystems//License Certificate File 1.0//EN"
    "http://www.moravia-microsystems.com/LicenseCertificate-1.1.dtd">

<certificate version="1.1">
    <product>
        <designation>Multitarget Development System</designation>
        <licences>5</licences>
        <variant>Commercial</variant>
        <grade>Professional</grade>
        <target>PicoBlaze</target>
    </product>
    <licensee>
        <name>Kelio s.r.o.</name>
        <type>company</type>
        <email>info@kelio.cz</email>
        <phone>+420777776720</phone>
        <address>
            <country>Czech Republic</country>
            <state></state>
            <municipality>Brno</municipality>
            <street>Maniƒçky</street>
            <number>43/12</number>
            <post>61600</post>
        </address>
    </licensee>
    <system>
        <timestamp>1406890984</timestamp>
        <userid>454503058c5b68f4d2e2dd3fb390b93a</userid>
        <orderid>2f498969904778335f1c320479ebefbc</orderid>
    </system>
</certificate>
